Unnamed: 0,Source File,Joined Title,Joined Description,Qualified categories
66,hackgt_2021.csv,Chemical Equation Balancer,"Inspiration
We wanted to make a hardware hack that would allow for inputs to be provided by a physical sensor, in this case a joystick.
What it does
The calculator takes in user input using the joystick to navigate through the periodic table of elements, and it balances the chemical equation built by the user using linear algebra. 
How we built it
All of the physical components (joystick, LCD display) are wired to an Arduino and some breadboards.
Challenges we ran into
It was difficult working through our experience gaps, especially with the type of project we chose being so technically complex and involved.
Accomplishments that we're proud of
We're proud to have the RREF algorithm functional and to have the physical component semi-functional--it just needed more time.
What we learned
We learned a lot about programming as a group and the challenges that comes with that, in addition to having two group members starting to learn C++ from scratch.
What's next for Chemical Equation Balancer
Hopefully to get it into a cleaner looking body!


Built With
arduinoc++",Best Hardware Hack
67,hackgt_2021.csv,Carousel,"Inspiration
Our team drew inspiration from the fact that many professors and TA's try to organize study groups for their classes, but they are rarely effective. We thought a student-centered, web-app approach to this concept would create more opportunities for students to find and stick with study groups. Also, we noticed the highly competitive academic culture here at Georgia Tech, and believed that this application would thrive.
What it does
Carousel allows users (students) to create an account and specify the courses they are taking. Then, it allows the user to search for a random study group based on course, date, and time, in which the user will be placed with other anonymous students. Carousel provides a study location, and from there, the rest is history.
How we built it
We designed Carousel as a web-application, with python powering the back-end functionality and HTML, CSS, and javascript on the front-end. We delegated tasks throughout the project, switching roles back and forth between front-end/back-end developer, researcher, etc.
Challenges we ran into
We ran into challenges while fetching data from input fields contained in the User Interface, and sending this data to the back-end side of the server. The data types were often complex, such as dates or times, and this accounted for plenty of challenges, especially while converting data between two separate languages. 
Accomplishments that we're proud of
We are proud of a very nice and aesthetically pleasing User Interface, along with the fact that we developed a mostly functioning program in just 36 hours.  
What we learned
We learned that a lot more goes into creating a web application from scratch than one would think, and unexpected challenges can present themselves which prove to be the hardest throughout the entire project.
What's next for Carousel
We plan to offer functionality for other categories, not just studying, such as pick-up sports or other recreational activities. Also, we plan to perfect our User Interface, continually test for bugs, and add more features relating to a user's account options and personalization.


Built With
crawlercssflaskgithubgtschedulerhtmljavascriptnumpypandaspythonvscode


Try it out



github.com","Best Education Hack, Best Web App"
68,hackgt_2021.csv,VaxPass,"Inspiration
It has been over a year and a half since the first COVID outbreak in the United States, and chances are we will need to learn to live with the virus for many years to come. Vaccination, without a doubt, is currently the most effective way to combat the virus is through vaccines. We got our inspiration from a privacy law class at Georgia Tech this semester; a great portion of the class focuses on vaccine passports and how to design them to maximize both security and privacy.
The two biggest challenges of vaccine passports are that similar systems tend to be centralized, which greatly lacks privacy, and the lack of transparency also implies less security. In an effort to come up with a solution that is the best of both worlds, we decided to employ blockchains as a way to implement the vaccine passport. Blockchains are inherently more transparent than a centralized system, and it is also extremely challenging to fake records on a blockchain by design. Given that many businesses now require individuals to be vaccinated and that there will be more and more people attempting to fake vaccination records, our product will prove integral to our new way of life by providing a reliable and secure vaccine passport to individuals and businesses.
What it does
VaxPass allows users to seamlessly and securely verify the COVID vaccination status of others. After signing in on an iPhone, each user is given a unique QR code representing their vaccine status. Users can either scan another person's QR code or can display their own QR code to others for verification of vaccination status. One of the most significant and important features of the app is that the only three pieces of information it shares about a user is a true/false value indicating whether the user meets vaccination requirements, the user's name, and the user's birthday (without the year). We do not display information about when the vaccine was received, what brand the vaccine was, how many doses the user has received, etc. because these are ultimately irrelevant to the other party regarding whether this person has been vaccinated or not. This also helps maintain maximum privacy as well as maximum efficiency. Information is stored either on the device or on an Ethereum blockchain after going through encryption.. 
How we built it
The group leveraged FirebaseAuth for Authentication and Firebase Firestore for storing user information. Google Cloud Platform powers the backend server, and we use the Python Flask framework for our API. In addition, our blockchain is built with Ethereum Smart Contracts and the Solidity language. The iOS app is written with Swift on the Xcode IDE. The iOS app uses frameworks like UIKit to build components, AVFoundation to scan QR codes, URLSession to make http requests to the backend. We also used Figma to create lo-fi and hi-fi wireframes for the app.
Challenges we ran into
None of us knew much about blockchain technology prior to the hackathon. We first had to determine which technologies to use to implement a blockchain, then decide which frameworks to use for our frontend and backend, implement the full-stack app, and, finally, plug all pieces together within 36 hours. We also had to figure out how to encrypt data that went onto the blockchain.
Accomplishments that we're proud of
We're proud that we created a functional blockchain! Despite being quite minimal, the blockchain was implemented entirely by ourselves from scratch, and through that, we were also able to fully understand how it functions.
We're also very proud of the fact that our idea is based on a product that promotes positive social impact. An app like this can potentially provide a privacy-aware solution for millions of people.
What we learned
The hackathon was an enormous learning experience for every single one of us. What we learned included, but is not limited to:

Blockchain implementation with Ethereum Smart Contracts
Solidity language
API setup with Flask
Deploying a backend with Google Cloud
Data Storage with Firebase
Wireframing with Figma
and many more.

What's next for VaxPass

Verifying negative test results
Vaccine Appointment Scheduler and Reminder
Vaccination Demographics
Registering and Tracking COVID-19 Diagnoses



Built With
figmafirebaseflaskgoogle-cloudpythonswift


Try it out



github.com



github.com



www.figma.com","Best Use of Figma, Best Blockchain App, Best Use of Google Cloud API, Best Use of Firebase, Best Use of C/C++ Rust Swift or Assembly, Best Mobile Hack"
69,hackgt_2021.csv,Caravan - Travel with New Friends!,"Inspiration
The experience of traveling is something that everyone should be able to relish. People enjoy making these experiences with friends and family. But, we believe that anyone should be able to have a fantastic travel experience even just as an individual. We wanted to make sure that anyone who wants to travel should be able to have a great experience and meet new people! The days of complicated coordination are over. In an age where face-to-face interaction has been declining, Caravan exhibits an unforgettable solution. Let us take over and give you an adventure and the chance to make lifelong friends! And so, we present Caravan - an innovative new iOS app for social gatherings to extend to new heights, depths, and distances!

What it does
Caravan changes the way people think about travel. No longer does one have to organize with friends or plan extremely ahead. Caravan offers the opportunity for people to find a trip and join a “caravan” of new people across the world in a travel experience. By bringing together different people in new ways, we can make a significant social impact - we are bridging the gap between social networking and real adventure. 
With our modular and aesthetically pleasing app, users browse a dynamic catalog of available locations. After selecting a location, the user is presented with trips that are organized by approved guides. With a glance, users can browse various types of upcoming trips within places across the world. With diverse dates, exciting trip headlines, and popularity metrics, any user can express interest in any trip they desire. They can then view more trip details, contact the guide with any questions, and sign up for further communication and updates through the app. Adventure is one click away! Bringing people together has never been done in a way that combines social connection with a quality travel experience in the way Caravan does. After the trip of a lifetime, our users bond with their trip mates, and they have grown not just their memories, but their friends! And who knows, you might just meet your future partner too!
Other transformative features of the Caravan app include dynamic profiles, where users can customize their profiles, keep and share records of past and upcoming trips, and show off cool badges they earn from making new experiences awarded by Caravan. 
Caravan also takes social networking to a new level, with Caravan’s community blog center, called Campsite. Here, users can share blog posts through pictures and stories detailing their adventures and encourage others to take the plunge! 
Last but not least, Caravan provides a way for users to communicate. Whether it be questions regarding an upcoming trip, discussing local restaurants to visit during the trip, or even just swapping stories with a fellow Caravner, our app changes the way we think about traveling and makes it accessible and a reality for anyone.

How we built it
We approached HackGT in a heavily engineering-focused methodology. Starting, we analyzed the participation packet and began to paint a picture of possible avenues. After completing our research period, the team commenced a brainstorming phase, where we wrote down possible ideas. These ideas held a wide range of topics to them and exciting software stacks. Next, we filtered down our thoughts through multiple filters such as our collective skill group, a niche in terms of topics, and overall enthusiasm for the project. After numerous discussions, the conclusion was made that we would pursue Caravan. Initially, we looked at creating a progressive web application but pivoted after looking at previous years' contenders. Finally, the decision was made to make the Caravan app through the SwiftUI framework. For our software, we utilized Object Orientated Programming and modular programming practice throughout our codebase. In addition, the team used git as version control to divide the problems into small tasks and seamlessly merge them. With our team breaking tasks into the smallest parts, we actively tested the codebase through the xcode's simulation suite, which allowed us to craft a beautiful UI/UX and test functionality. Through our wide range of tools, we were able to collaborate and create beautiful software.

Challenges we ran into
We are dedicated to excelling in both UI development and Database development because we believe that a delicate UI and a stable, fully functioning backend database is equally important. Along with our UI design and development, we have established Firebase connections and programmed working functions to get, post, and manipulate API structures and variables. However, the separation of UI development and Database development resulted in mistakes of file merging and sorting: the divergence in two GitHub lines caused the problem in merging UI and database. Next time, we will pay more attention to details, and management of working files. In addition to these challenges, the general time constraint prevented us from implementing other interactive features.

Accomplishments that we're proud of
We are proud of Caravan and we believe that our app will be able to significantly change the way people meet each other, while also giving our users the opportunity of a lifetime. We are proud of the appealing UI and experience users get, and we are even more proud of the services we provide to users. Our team came together and put 110% into this project, and we grew both as computer scientists and global innovators.

What we learned
HACKGT8 and the creation of Caravan taught us a lot. In addition to efficient teamwork, division of labor, design and development, the learning of technologies was definitely something we experienced. From picking up front-end Swift and SwiftUI app development skills to back-end Firebase database integration, we learned a lot in the process of creating this full-stack application.

What's next for Caravan
Caravan has the potential to expand into something even greater and there are a couple of thing we would start with:
We are looking to develop our back-end and database connection. First, we plan to develop the application to offer more user-friendly, targeted services for travelers. We will not only design and provide platforms for organized group traveling of travelers with shared interests and passion. Also, we will implement recommendation algorithms and analytical algorithms to better recommend favorite places, routes, travel friends, and prices.
Enabling cross-platform functionality is a goal of ours. Partnering with other social media leaders like Instagram and Snapchat.
We also want to introduce mechanisms for “verified creators” to create communities where they can share their stories and adventures, progress their brand, and give our users a more personal experience.
We also hope to partner with all parts of the travel experience such as the hospitality industry and the food industry to help our users receive a complete and comfortable experience.


Built With
bashfirebasegitgithubswiftswiftuiuikitxcode


Try it out



github.com","Best Hack Related to Travel/Transportation, Best Use of C/C++ Rust Swift or Assembly, Best Use of Firebase, Best Mobile Hack, Better Social Network, Best Communication and Community Hack"
70,hackgt_2021.csv,Discere Waterfall,"Inspiration
Minecraft, Where's my Water?
What it does
Builds and selects puzzles for logic game that users can access through their browser
How we built it
Using JavaScript, integrated website and game engine
Challenges we ran into
Implementing tree search algorithm, user interface
Accomplishments that we're proud of
Optimizing algorithm, Front-End product
What we learned
JavaScript, Front-End development, algorithm optimization
What's next for Discere Waterfall
Integrate current game to social system in which users can create and share problem


Built With
cssgithubjavascriptreact-native


Try it out



giovanni-hsu.github.io",Best Game
71,hackgt_2021.csv,Galactic Dialup,"Inspiration
I really wanted two explore two things: AssemblyAI, automatic speech recognition with excellent accuracy, and Unity, a widely popular game engine. Both of those things came together in this space-themed idea of intentionally messing with text translation of speech to create a unique puzzle-game!
What it does
Players start the game by clicking ""Play"", then clicking the ""record"" button on the top left. Say something like ""go left"" or ""go down"", and when you're done, click ""Send"". This will ""send"" your navigation instructions to the spaceship pilot. 
How I built it
First, I set up a way to obtain audio from the user (C#'s built-in Microphone class for PC/Linux/Mac build, and Unity Asset Store's WebGL-compatible CustomMicrophone class). Then, I export it to a .wav file with SavWav. Then I send this file to the AssemblyAI server with C# and, once the file finishes processing, receive the text transcription of the voice command. I then seek out particular directional words in that input and modify them so that the pilot in the spacecraft receives something slightly different than what was said.
Challenges I ran into
Firstly, I wanted to use AssemblyAI's Python supported language as I was most comfortable with it, and even had it working as a standalone program. Unfortunately, Unity does not support all libraries necessary for the python program to work (pyaudio, SpeechRecognition), so I had to scrap all working python files and switch over to the C# version. I also have never really used C# to the capacity that this project demanded, and ran into a lot of trouble with C#'s asynchronous features. Additionally, it was difficult to get the spaceship to move in a grid-like patter on the input of voice, not keypress, which is Unity's default. 
Accomplishments that I'm proud of
I was never sure I could actually have a whole game developed in Unity in 36 hours--let alone while incorporating a completely external API like AssemblyAI, and knowing how to work with neither of those tools beforehand. I'm also proud of how much I was able to accomplish despite being solo. I was initially uneasy about choosing to pursue this project by myself, that perhaps I wouldn't be able to make anything at all, but now I know that's simply not true.
What I learned
I learned every step of the Unity game development process, how AssemblyAI handles its speech to text transcription requests, and how to combine these two interests into something fun and unique.
What's next for Galactic Dialup
Originally, my idea was for this to be a two-player game--where the second player is the pilot of the spaceship, receiving only warped text from player. I would love to continue developing into that after improving level design, UI elements, animations, and optimizing the app's performance. I would love to include more challenging warpings of the speech-to-text, ones that require more than one instruction to circumvent. The great thing about AssemblyAI is that I already possess the tool for it--I can fetch whole sentences as opposed to Unity's default key phrase finder.


Built With
assemblyaic#itch.iomachine-learningnatural-language-processingpythonunitywebgl


Try it out



github.com



flippedout.itch.io","Best Game, The Best Use of AssemblyAI API, Best Natural Language Processing Hack"
72,hackgt_2021.csv,Spotomosphere,"Inspiration
We were inspired by the power of nature on your mood. We felt that there were appropriate song choices for certain times of the day and certain types of days. This led us to create a web page that recommends songs depending on the current weather and time, which the user may not have thought of before.
What it does
This application takes in data about the current weather along with time, and recommends a spotify playlist to the user. It also projects a relevant image depending on the weather and time of day it is.
How we built it
We built our project as a single page application using ReactJS. We built this using a weather API to pull the current weather data from. Depending on the current weather, we would display a symbol representing a sunny, rainy, cloudy, or thunderstorming type of day. With the weather and time data, we checked how they matched and outputted a corresponding playlist and photo. We also used the Spotify API which allows us to embed certain playlists into our website. 
Challenges we ran into
We had a hard time figuring out how to use the Spotify API to pull playlists and put it into our website. We also had challenges changing the background for each time of day. However, we were able to resolve our problems with team collaboration and further internet searches.
Accomplishments that we're proud of
We are proud of the dedication we had to creating a functional webpage using ReactJS, especially when our team members had zero prior experience in the language.
What we learned
We learned about the powerful capabilities of javascript, css, and html. We also got exposure to using APIs including the weather and spotify APIs.
What's next for Spotomosphere
We will move to a mobile application which can be used for Android and Apple. Since we learned mobile app development and UI/UX design for this hackathon event, we will keep working on this project for the foreseeable future.
As for the prizes, we are looking to compete for all emerging prizes and all general prizes. 


Built With
csshtml5javascriptnode.jsreactspotifyapiweatherapi


Try it out



jasongyubinchoi.github.io



github.com",Best Use of React 
